{
  "_id": "450374",
  "name": "Staging Firewall 21",
  "hostname": "host-0b80",
  "imageId": "434454",
  "imageName": "Secondary Scanner 05",
  "state": "created",
  "created": "2025-06-25T03:28:29Z",
  "cluster": "example-cluster",
  "namespace": "Primary Policy 38",
  "vulnerabilitiesCount": 68,
  "complianceIssuesCount": 453
}
